{"request_id":"plan_review-20260714T022450Z-8b0bdf","objective":"mint2-balanced-v2 seed79 gate 발사 게이트 — 07-14 외부감사 지적(TARGET_BALANCE 배치정규화·클래스가중 raw count·mint 활용 부족·메타 미사용 필드) 수정판. 묶음 probe(4변수 동시변경) 계획 감사.","verdict":"BLOCK","auditor_model":"GPT-5 Codex read-only","completed_at":"2026-07-14T02:27:11Z","blocking_findings":[{"id":"B1","summary":"핵심 diff 주장(dabf455d가 415e4c3e 대비 선언 변경만 포함)을 독립 확인할 증거가 없다.","evidence":"작업공간은 git 저장소가 아니어서 `git diff 415e4c3e` 불가했고, `find` 결과 로컬에는 현재 `open/scripts/colab_train_base2.py`만 존재했다. `open/coordination/logs/mint2b/effective_config_A_s79.json`은 카드1 코드 SHA가 415e4c3e였다는 사실만 증명하며, 415e4c3e 파일 내용 자체를 제공하지 않는다. 이전 data-auditor 결과(`open/coordination/results/plan_review-20260714T020320Z-mint2v2.json`)도 이 diff를 G-diff 필수 미확인 항목으로 남겼다. 직접 대조군과 intended_change의 범위를 결정하는 핵심 증거이므로 발사 전 fail-closed가 맞다."}],"nonblocking_findings":[{"id":"N1","summary":"빌더의 일부 설명 문자열이 실제 tiebreak 구현과 어긋난다.","evidence":"`scratchpad/build_mint2_balanced_v2.py` 실제 코드는 `_tw_cnt[tkey]` 후 id 순으로 정렬해 target-coverage 우선 tiebreak를 구현하지만, docstring/print에는 id-min 유지 표현이 남아 있다. 산출 데이터에는 영향 없지만 후속 감사 혼선을 만든다."},{"id":"N2","summary":"메타 안정필드 4종은 이번 Stage A에서 실질 신호로 쓰이지 않는다.","evidence":"데이터에는 user_tier/language_pref/workspace.loc/language_mix만 남지만, 계획상 PRETEXT_META=omit이고 `open/scripts/colab_train_base2.py:116`에서 [META] 라인이 생략되며 PRETEXT는 119d meta를 0화한다. 따라서 결과 해석은 '메타 활용'이 아니라 '메타 오염 제거/omit'로 제한해야 한다."}],"verified_claims":["읽기 순서 요구를 지켰다: AGENTS.md → HANDOFF.md → 실험로그 관련 절 → 대회규칙_채점환경.md → open/docs/checklists/README.md, 10_pre_training.md, 70_codex_workflow.md.","요청서의 현재 코드·데이터 SHA는 로컬 실측과 일치한다: colab dabf455d, builder 1aa52a8d, feat 91c419d6, v2 full/gate/labels/hidx 모두 선언값과 일치했다.","TB_V2 손실 수학은 코드상 배치독립 형태다: WT가 전역 mean=1로 정규화되고, TB_V2 분기는 `(per * wt.float()).mean()`을 사용한다. 기존 TB_V2=0 경로는 `(per*wt).sum()/wt.sum()` 그대로다.","TB_V2 클래스가중은 `sqrt_weights(y[idx_tr], WT[idx_tr] if TB_V2 else None)`로 호출되고, wt가 있으면 `np.bincount(..., weights=WT)`를 사용한다. wt=None 기존 경로도 보존되어 있다.","Stage B는 카드1 Stage B와 env상 real-only 구조다: PRETEXT false, EXTRA_DATA empty, TARGET_BALANCE false, HOLDOUT_IDX=hidx. TB_V2를 미설정해도 기존 카드1 Stage B 수학과 충돌하지 않는다.","v2 데이터 구조 검증 결과 full=6,829 rows/3,162 targets, gate=5,454 rows/2,542 targets, labels id 매칭 true, duplicate input 0, gate의 hidx holdout session intersection 0이었다.","v2 JSONL session_meta는 안정필드 4종만 포함하며 budget/elapsed/git_dirty/ci/open_files/turn_index는 없었다.","모호 input conflict는 2건이며 dedup 후 학습셋 내부 동일 input 교차라벨 모순은 남지 않는다.","HANDOFF §5의 죽은 축인 mint2 직접 동등가중 주입 재시도가 아니라, HANDOFF §6의 살아있는 balanced-mint 계열 수정 probe다.","계획은 묶음 4변수 probe라고 명시하고 있으며, holdout을 우열 판단이 아닌 밴드 자격 필터로 쓰겠다는 프레이밍은 규칙과 맞다."],"unverified_claims":["dabf455d와 415e4c3e 사이에 TB_V2/temp-assert 외 미선언 drift가 없다는 주장.","치타 GPU 2장 idle 여부, 디스크 여유, 원격 업로드된 colab/feat/data SHA 상태.","발사 launcher가 root drift 파일(cb3ce5d8 등)을 피하고 run_mint2v2_s79 디렉터리의 dabf455d만 사용할 것이라는 주장.","향후 band/LB 결과와 seed79 draw의 실제 서버 성능."],"confounders":["이번 계획은 ①TB_V2 손실 ②TB_V2 클래스가중 ③strict 6,829 window 데이터 ④PRETEXT_META omit/메타 안정필드 정리를 동시에 바꾸는 묶음 probe이므로 어떤 결과도 단독효과로 귀속할 수 없다.","코드 SHA 자체도 415e4c3e→dabf455d로 바뀌며, old-code diff 미확인 상태에서는 추가 코드 drift 가능성이 남는다.","seed79 단일 draw이므로 결과 해석은 seed·학습 draw 상호작용 범위 안에서 제한해야 한다.","full 배포 Stage A 데이터는 holdout 세션도 포함할 수 있으나, gate 검증에는 gate 데이터만 사용해야 한다."],"required_fixes":["발사 전 415e4c3e 원본 `colab_train_base2.py`를 로컬 evidence로 제공하거나, 치타 카드1 run 디렉터리의 415e4c3e와 dabf455d 사이 unified diff를 고정 스냅샷으로 제공하라. 허용 hunk는 TB_V2 플래그/손실/class-weight와 SOFT_TARGET temperature assert의 비활성 변경뿐이어야 한다.","새 evidence로 재감사하라. diff에 미선언 변경이 있으면 intended_change와 confounders를 갱신하고 plan_review를 다시 받아야 한다.","pre_launch 단계에서는 원격 SHA 업로드 목록(colab dabf455d, feat 91c419d6, v2 gate/json labels SHA), root drift 미사용, GPU/디스크 상태, Stage A/B effective_config diff를 별도 evidence로 제시하라."],"safe_next_action":"BLOCK — 지금 상태로는 run_mint2v2_s79를 발사하지 말고, 415e4c3e↔dabf455d diff 증거를 먼저 수집한 뒤 새 request_id로 재감사한다.","evidence_references":["AGENTS.md","open/docs/HANDOFF.md","open/docs/실험로그.md:1498","open/docs/대회규칙_채점환경.md","open/docs/checklists/10_pre_training.md","open/docs/checklists/70_codex_workflow.md","open/scripts/colab_train_base2.py:78","open/scripts/colab_train_base2.py:116","open/scripts/colab_train_base2.py:219","open/scripts/colab_train_base2.py:299","open/scripts/colab_train_base2.py:374","open/scripts/colab_train_base2.py:403","scratchpad/build_mint2_balanced_v2.py:60","scratchpad/build_mint2_balanced_v2.py:110","scratchpad/build_mint2_balanced_v2.py:141","scratchpad/mint2_v2_label_conflicts.json","open/coordination/logs/mint2b/effective_config_A_s79.json","open/coordination/logs/mint2b/effective_config_B_s79.json","open/coordination/results/plan_review-20260714T020320Z-mint2v2.json"],"artifact_sha":[{"path":"open/scripts/colab_train_base2.py","sha256":"dabf455d3cc93f2185ae9c4bd3733e3adc7690f4defab040ac29d3214fd4e8c3"},{"path":"scratchpad/build_mint2_balanced_v2.py","sha256":"1aa52a8d22cf85e81789323ff0e72133dd91d8a6f2b8afec693e8c5056a4b604"},{"path":"open/scripts/feat.py","sha256":"91c419d634a85ad912d3dc43b9c802ddf0f1a31b0a203345cb38779b30b05ca8"},{"path":"open/data/train_mint2_balanced_v2.jsonl","sha256":"17d753527a406085dcb6fa50f6f708b0a265a3d43a1727dde9386f225811022e"},{"path":"open/data/train_mint2_balanced_v2_gate.jsonl","sha256":"05fad50e76545cb499e0fedaf56d8df7edb588a3aa991015575f1c5209f22466"},{"path":"open/data/train_mint2_balanced_v2_labels.csv","sha256":"aea580d3655f4a4c9250e1986b84eb861f958d486e45d337360fce3299fd3bd1"},{"path":"open/data/train_mint2_balanced_v2_gate_labels.csv","sha256":"6bb8c1b1571dfaacb79a5b3f3b62ad850a3eecbdc7d34b3e53caa828a20ef122"},{"path":"scratchpad/hidx.npy","sha256":"e39aae253087b4ac08f2550005e08421584a2dbc273adf64c692a6b0f1b0feae"},{"path":"scratchpad/mint2_v2_label_conflicts.json","sha256":"5e2eaaf24b3ca6db6b4d407fcdef94ddc4525e3bfc86cda6291aa7b349aaab8a"},{"path":"open/coordination/results/post_lb-20260714T014500Z-round3.json","sha256":"401c85f8faca01beaa8c86b1b154bb56b4c7d377fb1ec0e6c4de40ad7af7d545"}]}